{
  "type": "aos.employer_brand_live_evidence_url_reachability_check",
  "schema_version": "2026-05-employer-brand-live-evidence-url-reachability-check-v0",
  "id": "live-evidence-url-reachability-check:symphony-talent-phenom-radancy",
  "label": "Symphony Talent Employer Brand Comparative Audit Project Live Evidence URL Reachability Check",
  "status": "checked_with_blockers",
  "source_refs": {
    "supervised_locator_plan_id": "live-evidence-supervised-locator-plan:symphony-talent-phenom-radancy",
    "supervised_locator_plan_path": "live-evidence-supervised-locator-plan.json",
    "supervised_locator_plan_schema": "shared/schemas/employer-brand-live-evidence-supervised-locator-plan-v0.schema.json",
    "locator_readiness_id": "live-evidence-locator-readiness:symphony-talent-phenom-radancy",
    "locator_readiness_path": "live-evidence-locator-readiness.json",
    "reviewed_target_plan_id": "live-evidence-reviewed-target-plan:symphony-talent-phenom-radancy",
    "reviewed_target_plan_path": "live-evidence-target-plan.reviewed.json",
    "data_bundle_id": "employer-brand-comparative-audit-data-bundle:symphony-talent-phenom-radancy",
    "data_bundle_path": "data-bundle.json",
    "url_open_run_id": "live-evidence-url-open-run:symphony-talent-phenom-radancy",
    "url_open_run_path": "live-evidence-url-open-run.json",
    "url_open_run_schema": "shared/schemas/employer-brand-live-evidence-url-open-run-v0.schema.json"
  },
  "summary": {
    "not_checked_count": 0,
    "reachable_count": 5,
    "blocked_count": 2,
    "redirected_count": 2,
    "login_required_count": 0,
    "paywall_count": 0,
    "captcha_count": 0,
    "consent_required_count": 0,
    "network_error_count": 9,
    "safety_gate_blocked_count": 2,
    "supervised_locator_work_unit_count": 18,
    "executable_target_count": 16,
    "non_executed_blocked_target_count": 2,
    "checked_count": 16,
    "same_domain_confirmed_count": 16,
    "same_domain_unknown_count": 2
  },
  "results": [
    {
      "result_id": "url-reachability-result:symphony-talent:careers-site",
      "work_unit_id": "live-locator-work-unit:symphony-talent:careers-site",
      "target_id": "live-target:symphony-talent:careers-site",
      "executable": true,
      "executed": true,
      "non_executed": false,
      "status": "reachable",
      "url": "https://www.symphonytalent.com/",
      "final_url": "https://www.symphonytalent.com/",
      "same_domain_gate": {
        "requested_origin": "https://www.symphonytalent.com",
        "requested_hostname": "www.symphonytalent.com",
        "expected_origin": "https://www.symphonytalent.com",
        "same_domain_required": true,
        "same_domain": true
      },
      "http": {
        "status_code": 200,
        "status_text": null,
        "method": "GET",
        "headers_observed": true
      },
      "blocker_reason": null,
      "checked_at": "2026-05-08T15:30:03.636Z",
      "operator_notes": "Bounded supervised URL open recorded only navigation metadata; no locator, element, screenshot, clip, report, export, workflow, or crawl work was performed.",
      "review_status": "checked_by_bounded_url_open_run",
      "safety_gates": [
        "human_approval_required",
        "same_domain_constraint",
        "no_autonomous_crawl",
        "no_login_paywall_captcha_or_consent_bypass",
        "no_element_identification",
        "no_locator_resolution",
        "no_codegen",
        "no_screenshots",
        "no_clips",
        "no_full_page_grabs"
      ],
      "provenance": {
        "source_supervised_locator_plan_target_id": "live-target:symphony-talent:careers-site",
        "source_supervised_locator_plan_work_unit_id": "live-locator-work-unit:symphony-talent:careers-site",
        "source_index": 0,
        "source_url_open_result_id": "url-open-result:symphony-talent:careers-site",
        "planning_check_only": false,
        "read_only": true
      }
    },
    {
      "result_id": "url-reachability-result:symphony-talent:employer-brand-pages",
      "work_unit_id": "live-locator-work-unit:symphony-talent:employer-brand-pages",
      "target_id": "live-target:symphony-talent:employer-brand-pages",
      "executable": true,
      "executed": true,
      "non_executed": false,
      "status": "network_error",
      "url": "https://www.symphonytalent.com/careers/culture",
      "final_url": "https://www.symphonytalent.com/careers/culture",
      "same_domain_gate": {
        "requested_origin": "https://www.symphonytalent.com",
        "requested_hostname": "www.symphonytalent.com",
        "expected_origin": "https://www.symphonytalent.com",
        "same_domain_required": true,
        "same_domain": true
      },
      "http": {
        "status_code": 404,
        "status_text": null,
        "method": "GET",
        "headers_observed": true
      },
      "blocker_reason": null,
      "checked_at": "2026-05-08T15:30:03.636Z",
      "operator_notes": "Bounded supervised URL open recorded only navigation metadata; no locator, element, screenshot, clip, report, export, workflow, or crawl work was performed.",
      "review_status": "checked_by_bounded_url_open_run",
      "safety_gates": [
        "human_approval_required",
        "same_domain_constraint",
        "no_autonomous_crawl",
        "no_login_paywall_captcha_or_consent_bypass",
        "no_element_identification",
        "no_locator_resolution",
        "no_codegen",
        "no_screenshots",
        "no_clips",
        "no_full_page_grabs"
      ],
      "provenance": {
        "source_supervised_locator_plan_target_id": "live-target:symphony-talent:employer-brand-pages",
        "source_supervised_locator_plan_work_unit_id": "live-locator-work-unit:symphony-talent:employer-brand-pages",
        "source_index": 1,
        "source_url_open_result_id": "url-open-result:symphony-talent:employer-brand-pages",
        "planning_check_only": false,
        "read_only": true
      }
    },
    {
      "result_id": "url-reachability-result:symphony-talent:linkedin-presence",
      "work_unit_id": "live-locator-work-unit:symphony-talent:linkedin-presence",
      "target_id": "live-target:symphony-talent:linkedin-presence",
      "executable": true,
      "executed": true,
      "non_executed": false,
      "status": "reachable",
      "url": "https://www.linkedin.com/company/symphony-talent/",
      "final_url": "https://www.linkedin.com/company/symphony-talent/",
      "same_domain_gate": {
        "requested_origin": "https://www.linkedin.com",
        "requested_hostname": "www.linkedin.com",
        "expected_origin": "https://www.linkedin.com",
        "same_domain_required": true,
        "same_domain": true
      },
      "http": {
        "status_code": 200,
        "status_text": null,
        "method": "GET",
        "headers_observed": true
      },
      "blocker_reason": null,
      "checked_at": "2026-05-08T15:30:03.636Z",
      "operator_notes": "Bounded supervised URL open recorded only navigation metadata; no locator, element, screenshot, clip, report, export, workflow, or crawl work was performed.",
      "review_status": "checked_by_bounded_url_open_run",
      "safety_gates": [
        "human_approval_required",
        "same_domain_constraint",
        "no_autonomous_crawl",
        "no_login_paywall_captcha_or_consent_bypass",
        "no_element_identification",
        "no_locator_resolution",
        "no_codegen",
        "no_screenshots",
        "no_clips",
        "no_full_page_grabs"
      ],
      "provenance": {
        "source_supervised_locator_plan_target_id": "live-target:symphony-talent:linkedin-presence",
        "source_supervised_locator_plan_work_unit_id": "live-locator-work-unit:symphony-talent:linkedin-presence",
        "source_index": 2,
        "source_url_open_result_id": "url-open-result:symphony-talent:linkedin-presence",
        "planning_check_only": false,
        "read_only": true
      }
    },
    {
      "result_id": "url-reachability-result:symphony-talent:social-campaigns",
      "work_unit_id": "live-locator-work-unit:symphony-talent:social-campaigns",
      "target_id": "live-target:symphony-talent:social-campaigns",
      "executable": true,
      "executed": true,
      "non_executed": false,
      "status": "network_error",
      "url": "https://www.symphonytalent.com/news",
      "final_url": "https://www.symphonytalent.com/news",
      "same_domain_gate": {
        "requested_origin": "https://www.symphonytalent.com",
        "requested_hostname": "www.symphonytalent.com",
        "expected_origin": "https://www.symphonytalent.com",
        "same_domain_required": true,
        "same_domain": true
      },
      "http": {
        "status_code": 404,
        "status_text": null,
        "method": "GET",
        "headers_observed": true
      },
      "blocker_reason": null,
      "checked_at": "2026-05-08T15:30:03.636Z",
      "operator_notes": "Bounded supervised URL open recorded only navigation metadata; no locator, element, screenshot, clip, report, export, workflow, or crawl work was performed.",
      "review_status": "checked_by_bounded_url_open_run",
      "safety_gates": [
        "human_approval_required",
        "same_domain_constraint",
        "no_autonomous_crawl",
        "no_login_paywall_captcha_or_consent_bypass",
        "no_element_identification",
        "no_locator_resolution",
        "no_codegen",
        "no_screenshots",
        "no_clips",
        "no_full_page_grabs"
      ],
      "provenance": {
        "source_supervised_locator_plan_target_id": "live-target:symphony-talent:social-campaigns",
        "source_supervised_locator_plan_work_unit_id": "live-locator-work-unit:symphony-talent:social-campaigns",
        "source_index": 3,
        "source_url_open_result_id": "url-open-result:symphony-talent:social-campaigns",
        "planning_check_only": false,
        "read_only": true
      }
    },
    {